"","OCEAN","ID_mrgd","nm_mrgd","continent_map","fa_ffcl"
"1","Pacific",81,"Pacific, Southwest",NA,NA
"2","Pacific",67,"Pacific, Northeast",NA,NA
"3","Atlantic",27,"Atlantic, Northeast",NA,NA
"4","Southern Ocean",58,"Indian Ocean, Antarctic",NA,NA
"5","Southern Ocean",48,"Atlantic, Antarctic",NA,NA
"6","Southern Ocean",88,"Pacific, Antarctic",NA,NA
"7","Atlantic",47,"Atlantic, Southeast",NA,NA
"8","Arctic",18,"Arctic Sea",NA,NA
"9","Atlantic",34,"Atlantic, Eastern Central",NA,NA
"10","Pacific",61,"Pacific, Northwest",NA,NA
"11","Atlantic",41,"Atlantic, Southwest",NA,NA
"12","Atlantic",21,"Atlantic, Northwest",NA,NA
"13","Pacific",71,"Pacific, Western Central",NA,NA
"14","Indian",51,"Indian Ocean, Western",NA,NA
"15","Atlantic",31,"Atlantic, Western Central",NA,NA
"16","Pacific",87,"Pacific, Southeast",NA,NA
"17","Indian",57,"Indian Ocean, Eastern",NA,NA
"18","Pacific",77,"Pacific, Eastern Central",NA,NA
"19",NA,8444,"American Samoa Exclusive Economic Zone","Oceania","American Samoa"
"20",NA,8379,"Ascension Exclusive Economic Zone","Africa","Ascension, Saint Helena and Tristan da Cunha"
"21",NA,8446,"Cook Islands Exclusive Economic Zone","Oceania","the Cook Islands"
"22",NA,8389,"Overlapping claim Falkland / Malvinas Islands: UK / Argentina","Americas",NA
"23",NA,8440,"French Polynesian Exclusive Economic Zone","Oceania","French Polynesia"
"24",NA,8439,"Pitcairn Islands Exclusive Economic Zone","Oceania","Pitcairn"
"25",NA,8380,"St. Helena Exclusive Economic Zone","Africa","Ascension, Saint Helena and Tristan da Cunha"
"26",NA,8445,"Samoan Exclusive Economic Zone","Oceania","the Independent State of Samoa"
"27",NA,8448,"Tongan Exclusive Economic Zone","Oceania","the Kingdom of Tonga"
"28",NA,8382,"Tristan Da Cunha Exclusive Economic Zone","Africa","Ascension, Saint Helena and Tristan da Cunha"
"29",NA,8465,"Chilean Exclusive Economic Zone","Americas","the Republic of Chile"
"30",NA,8447,"Niue Exclusive Economic Zone","Oceania","Niue"
"31",NA,48961,"Joint regime area Argentina / Uruguay","Americas",NA
"32",NA,48962,"Joint regime area Peru / Ecuador","Americas",NA
"33",NA,8467,"Uruguayan Exclusive Economic Zone","Americas","the Eastern Republic of Uruguay"
"34",NA,8449,"Tokelau Exclusive Economic Zone","Oceania","Tokelau"
"35",NA,8432,"Peruvian Exclusive Economic Zone","Americas","the Republic of Peru"
"36",NA,22756,"Chilean Exclusive Economic Zone (San Felix and San Ambrosio islands)","Americas","the Republic of Chile"
"37",NA,21787,"Chilean Exclusive Economic Zone (Easter Island)","Americas","the Republic of Chile"
"38",NA,8381,"Brazilian Exclusive Economic Zone (Trindade)","Americas","the Federative Republic of Brazil"
"39",NA,8450,"Kiribati Exclusive Economic Zone (Phoenix Islands)","Oceania","the Republic of Kiribati"
"40",NA,8466,"Argentinean Exclusive Economic Zone","Americas","the Argentine Republic"
"41",NA,8386,"Amsterdam Island & St. Paul Island Exclusive Economic Zone","Africa",NA
"42",NA,8309,"Christmas Island Exclusive Economic Zone","Oceania","Christmas Island"
"43",NA,8308,"Cocos Islands Exclusive Economic Zone","Oceania","the Cocos (Keeling) Islands"
"44",NA,8334,"Comoran Exclusive Economic Zone","Africa","the Union of the Comoros"
"45",NA,8385,"Crozet Islands Exclusive Economic Zone","Africa",NA
"46",NA,48944,"Overlapping claim Mayotte: France / Comoros","Africa",NA
"47",NA,48946,"Overlapping claim Ile Tromelin: Reunion / Madagascar / Mauritus",NA,NA
"48",NA,8388,"Heard and McDonald Islands Exclusive Economic Zone","Oceania","Heard Island and McDonald Islands"
"49",NA,8387,"Kerguelen Exclusive Economic Zone","Africa",NA
"50",NA,8348,"Madagascan Exclusive Economic Zone","Africa","the Republic of Madagascar"
"51",NA,8396,"South African Exclusive Economic Zone","Africa","the Republic of South Africa"
"52",NA,8312,"New Caledonian Exclusive Economic Zone","Oceania","New Caledonia"
"53",NA,8310,"Norfolk Island Exclusive Economic Zone","Oceania","Norfolk Island"
"54",NA,8343,"Mauritian Exclusive Economic Zone","Africa","the Republic of Mauritius"
"55",NA,8338,"Réunion Exclusive Economic Zone","Africa","Réunion"
"56",NA,8313,"Vanuatu Exclusive Economic Zone","Oceania","the Republic of Vanuatu"
"57",NA,8395,"Namibian Exclusive Economic Zone","Africa","the Republic of Namibia"
"58",NA,21791,"Oecussi Ambeno Exclusive Economic Zone","Asia",NA
"59",NA,8394,"Congolese Exclusive Economic Zone","Africa","the Republic of the Congo"
"60",NA,8478,"Angolan Exclusive Economic Zone","Africa","the Republic of Angola"
"61",NA,8347,"Mozambican Exclusive Economic Zone","Africa","the Republic of Mozambique"
"62",NA,8349,"Kenyan Exclusive Economic Zone","Africa","the Republic of Kenya"
"63",NA,21798,"Protected Zone established under the Torres Strait Treaty","Oceania",NA
"64",NA,8384,"South African Exclusive Economic Zone (Prince Edward Islands)","Africa",NA
"65",NA,8479,"Tanzanian Exclusive Economic Zone","Africa","the United Republic of Tanzania"
"66",NA,8314,"Solomon Islands Exclusive Economic Zone","Oceania","Solomon Islands"
"67",NA,8337,"Seychellois Exclusive Economic Zone","Africa","the Republic of Seychelles"
"68",NA,48945,"Overlapping claim Glorioso Islands: France / Madagascar",NA,NA
"69",NA,8341,"Ile Europa Exclusive Economic Zone","Africa",NA
"70",NA,48948,"Overlapping claim Matthew and Hunter Islands: New Caledonia / Vanuatu",NA,NA
"71",NA,8477,"Democratic Republic of the Congo Exclusive Economic Zone","Africa","the Democratic Republic of the Congo"
"72",NA,8323,"Australian Exclusive Economic Zone","Oceania","Australia"
"73",NA,8311,"Australian Exclusive Economic Zone (Macquarie Island)","Oceania","Australia"
"74",NA,8339,"Juan de Nova Exclusive Economic Zone","Africa",NA
"75",NA,8340,"Bassas da India Exclusive Economic Zone","Africa","the French Southern Territories"
"76",NA,33176,"Overlapping claim: Kenya / Somalia","Africa",NA
"77",NA,8758,"East Timorian Exclusive Economic Zone","Asia","the Democratic Republic of Timor-Leste"
"78",NA,8412,"Anguilla Exclusive Economic Zone","Americas","Anguilla"
"79",NA,8414,"Antigua and Barbuda Exclusive Economic Zone","Americas","Antigua and Barbuda"
"80",NA,26519,"Aruban Exclusive Economic Zone","Americas","Aruba"
"81",NA,8361,"Portuguese Exclusive Economic Zone (Azores)","Europe","the Portuguese Republic"
"82",NA,8404,"Bahamas Exclusive Economic Zone","Americas","the Commonwealth of the Bahamas"
"83",NA,8418,"Barbados Exclusive Economic Zone","Americas","Barbados"
"84",NA,8429,"Mexican Exclusive Economic Zone","Americas","the United Mexican States"
"85",NA,26520,"Bonaire Exclusive Economic Zone","Americas","Bonaire, Sint Eustatius and Saba"
"86",NA,8411,"British Virgin Islands Exclusive Economic Zone","Americas","the British Virgin Islands"
"87",NA,8362,"Cape Verdean Exclusive Economic Zone","Africa","the Republic of Cabo Verde"
"88",NA,8364,"Spanish Exclusive Economic Zone (Canary Islands)","Europe","the Kingdom of Spain"
"89",NA,8407,"Cayman Islands Exclusive Economic Zone","Americas","the Cayman Islands"
"90",NA,8401,"Clipperton Exclusive Economic Zone","Oceania","French Polynesia"
"91",NA,8423,"Panamanian Exclusive Economic Zone","Americas","the Republic of Panama"
"92",NA,8424,"Costa Rican Exclusive Economic Zone","Americas","the Republic of Costa Rica"
"93",NA,26517,"Curaçaoan Exclusive Economic Zone","Americas","Curaçao"
"94",NA,8417,"Dominican Exclusive Economic Zone","Americas","the Commonwealth of Dominica"
"95",NA,8409,"Dominican Republic Exclusive Economic Zone","Americas","the Dominican Republic"
"96",NA,8430,"Guatemalan Exclusive Economic Zone","Americas","the Republic of Guatemala"
"97",NA,8435,"Faeroe Exclusive Economic Zone","Europe","the Faroe Islands"
"98",NA,8370,"Gambian Exclusive Economic Zone","Africa","the Republic of the Gambia"
"99",NA,8365,"Overlapping claim Gibraltarian Exclusive Economic Zone","Europe",NA
"100",NA,8419,"Grenadian Exclusive Economic Zone","Americas","Grenada"
"101",NA,33177,"Guadeloupean Exclusive Economic Zone","Americas","Guadeloupe"
"102",NA,8390,"Sierra Leonian Exclusive Economic Zone","Africa","the Republic of Sierra Leone"
"103",NA,5680,"Icelandic Exclusive Economic Zone","Europe","Iceland"
"104",NA,8459,"Jamaican Exclusive Economic Zone","Americas","Jamaica"
"105",NA,8363,"Portuguese Exclusive Economic Zone (Madeira)","Europe","the Portuguese Republic"
"106",NA,8369,"Mauritanian Exclusive Economic Zone","Africa","the Islamic Republic of Mauritania"
"107",NA,8415,"Montserrat Exclusive Economic Zone","Americas","Montserrat"
"108",NA,48951,"Overlapping claim Navassa Island: USA / Haiti / Jamaica","Americas",NA
"109",NA,8443,"Palmyra Atoll Exclusive Economic Zone","Oceania","the United States Minor Outlying Islands"
"110",NA,33179,"Puerto Rican Exclusive Economic Zone","Americas","the Commonwealth of Puerto Rico"
"111",NA,26518,"Saba Exclusive Economic Zone","Americas","Bonaire, Sint Eustatius and Saba"
"112",NA,48952,"Saint-Barthélemy Exclusive Economic Zone","Americas","Saint-Barthélemy"
"113",NA,26526,"Sint-Eustatius Exclusive Economic Zone","Americas","Bonaire, Sint Eustatius and Saba"
"114",NA,8413,"Saint Kitts and Nevis Exclusive Economic Zone","Americas","Saint Kitts and Nevis"
"115",NA,8416,"Saint Lucia Exclusive Economic Zone","Americas","Saint Lucia"
"116",NA,8495,"Saint-Martin Exclusive Economic Zone","Americas","Saint-Martin (French part)"
"117",NA,8494,"Saint-Pierre and Miquelon Exclusive Economic Zone","Americas","Saint Pierre and Miquelon"
"118",NA,8421,"Saint Vincent and the Grenadines Exclusive Economic Zone","Americas","Saint Vincent and the Grenadines"
"119",NA,21803,"Sint-Maarten Exclusive Economic Zone","Americas","Sint Maarten (Dutch part)"
"120",NA,8420,"Trinidad and Tobago Exclusive Economic Zone","Americas","the Republic of Trinidad and Tobago"
"121",NA,8405,"Turks and Caicos Exclusive Economic Zone","Americas","the Turks and Caicos Islands"
"122",NA,33180,"Virgin Islander Exclusive Economic Zone","Americas","the United States Virgin Islands"
"123",NA,5688,"Portuguese Exclusive Economic Zone","Europe","the Portuguese Republic"
"124",NA,8428,"El Salvador Exclusive Economic Zone","Americas","the Republic of El Salvador"
"125",NA,8457,"Belizean Exclusive Economic Zone","Americas","Belize"
"126",NA,8406,"Cuban Exclusive Economic Zone","Americas","the Republic of Cuba"
"127",NA,8408,"Haitian Exclusive Economic Zone","Americas","the Republic of Haiti"
"128",NA,33178,"Martinican Exclusive Economic Zone","Americas","Martinique"
"129",NA,48964,"Joint regime area Senegal / Guinea Bissau","Africa",NA
"130",NA,48965,"Overlapping claim: Venezuela / Aruba / Dominican Republic","Americas",NA
"131",NA,48966,"Joint regime area Spain / France","Europe",NA
"132",NA,48967,"Joint regime area United Kingdom / Denmark (Faeroe Islands)","Europe",NA
"133",NA,48943,"Overlapping claim: Canada / USA","Americas",NA
"134",NA,48968,"Joint regime area Costa Rica / Ecuador (Galapagos)","Americas",NA
"135",NA,8425,"Nicaraguan Exclusive Economic Zone","Americas","the Republic of Nicaragua"
"136",NA,8460,"Guyanese Exclusive Economic Zone","Americas","the Co-operative Republic of Guyana"
"137",NA,48969,"Joint regime area Guyana / Barbados","Americas",NA
"138",NA,48970,"Joint regime area Colombia / Dominican Republic","Americas",NA
"139",NA,48971,"Overlapping claim: Venezuela / Colombia / Dominican Republic","Americas",NA
"140",NA,5681,"Irish Exclusive Economic Zone","Europe","Ireland"
"141",NA,21788,"Guernsey Exclusive Economic Zone","Europe","the Bailiwick of Guernsey"
"142",NA,21789,"Jersey Exclusive Economic Zone","Europe","the Bailiwick of Jersey"
"143",NA,8371,"Senegalese Exclusive Economic Zone","Africa","the Republic of Senegal"
"144",NA,8471,"Guinea Bissau Exclusive Economic Zone","Africa","the Republic of Guinea-Bissau"
"145",NA,8472,"Guinean Exclusive Economic Zone","Africa","the Republic of Guinea"
"146",NA,8473,"Ivory Coast Exclusive Economic Zone","Africa","the Republic of Côte d'Ivoire"
"147",NA,33185,"Overlapping claim: Trinidad and Tobago / Venezuela / Guyana","Americas",NA
"148",NA,8391,"Liberian Exclusive Economic Zone","Africa","the Republic of Liberia"
"149",NA,21792,"Joint regime area Colombia / Jamaica","Americas",NA
"150",NA,48972,"Joint regime area Honduras / Cayman Islands","Americas",NA
"151",NA,48973,"Joint regime area Iceland / Denmark (Faeroe Islands)","Europe",NA
"152",NA,8433,"Venezuelan Exclusive Economic Zone","Americas","the Bolivarian Republic of Venezuela"
"153",NA,8427,"Honduran Exclusive Economic Zone","Americas","the Republic of Honduras"
"154",NA,48974,"Joint regime area Ecuador / Colombia","Americas",NA
"155",NA,48975,"Joint regime area Iceland / Norway (Jan Mayen)","Europe",NA
"156",NA,8493,"Canadian Exclusive Economic Zone","Americas","Canada"
"157",NA,8368,"Overlapping claim Western Saharan Exclusive Economic Zone","Africa",NA
"158",NA,8461,"Surinamese Exclusive Economic Zone","Americas","the Republic of Suriname"
"159",NA,8462,"French Guiana Exclusive Economic Zone","Americas","French Guiana"
"160",NA,48982,"Overlapping claim: Puerto Rico / Dominican Republic","Americas",NA
"161",NA,8452,"Johnston Atoll Exclusive Economic Zone","Oceania","the United States Minor Outlying Islands"
"162",NA,8426,"Colombian Exclusive Economic Zone","Americas","the Republic of Colombia"
"163",NA,62596,"Colombian Exclusive Economic Zone (Serrana)","Americas","the Republic of Colombia"
"164",NA,62598,"Colombian Exclusive Economic Zone (Quitasueño)","Americas","the Republic of Colombia"
"165",NA,48984,"Colombian Exclusive Economic Zone (Serranilla)","Americas","the Republic of Colombia"
"166",NA,48985,"Colombian Exclusive Economic Zone (Bajo Nuevo)","Americas","the Republic of Colombia"
"167",NA,8367,"Moroccan Exclusive Economic Zone","Africa","the Kingdom of Morocco"
"168",NA,49000,"Overlapping claim Melilla: Spain / Morocco","Africa",NA
"169",NA,49001,"Overlapping claim Alhucemas Islands: Spain / Morocco","Africa",NA
"170",NA,48998,"Overlapping claim Perejil Island: Spain / Morocco","Africa",NA
"171",NA,49002,"Overlapping claim Ceuta: Spain / Morocco","Africa",NA
"172",NA,48999,"Overlapping claim Peñón de Vélez de la Gomera: Spain / Morocco","Africa",NA
"173",NA,48997,"Overlapping claim Chafarinas Islands: Spain / Morocco","Africa",NA
"174",NA,8360,"United Arab Emirates Exclusive Economic Zone","Asia","the United Arab Emirates"
"175",NA,8376,"Cypriote Exclusive Economic Zone","Asia","the Republic of Cyprus"
"176",NA,48947,"Overlapping claim: Iran / United Arab Emirates","Asia",NA
"177",NA,48956,"Overlapping claim Doumeira Islands: Djibouti / Eritrea","Africa",NA
"178",NA,8490,"Egyptian Exclusive Economic Zone","Africa","the Arab Republic of Egypt"
"179",NA,8351,"Eritrean Exclusive Economic Zone","Africa","the State of Eritrea"
"180",NA,5678,"Georgian Exclusive Economic Zone","Asia","Georgia"
"181",NA,8469,"Iranian Exclusive Economic Zone","Asia","the Islamic Republic of Iran"
"182",NA,8374,"Lebanese Exclusive Economic Zone","Asia","the Lebanese Republic"
"183",NA,8372,"Libyan Exclusive Economic Zone","Africa","the State of Libya"
"184",NA,5685,"Maltese Exclusive Economic Zone","Europe","the Republic of Malta"
"185",NA,8354,"Omani Exclusive Economic Zone","Asia","the Sultanate of Oman"
"186",NA,8356,"Saudi Arabian Exclusive Economic Zone","Asia","the Kingdom of Saudi Arabia"
"187",NA,8346,"Sri Lankan Exclusive Economic Zone","Asia","the Democratic Socialist Republic of Sri Lanka"
"188",NA,8355,"Sudanese Exclusive Economic Zone","Africa","the Republic of the Sudan"
"189",NA,8373,"Syrian Exclusive Economic Zone","Asia","the Syrian Arab Republic"
"190",NA,8392,"Togolese Exclusive Economic Zone","Africa","the Togolese Republic"
"191",NA,5679,"Greek Exclusive Economic Zone","Europe","the Hellenic Republic"
"192",NA,5697,"Turkish Exclusive Economic Zone","Asia","the Republic of Türkiye"
"193",NA,21790,"Monégasque Exclusive Economic Zone","Europe","the Principality of Monaco"
"194",NA,8366,"Tunisian Exclusive Economic Zone","Africa","the Republic of Tunisia"
"195",NA,5691,"Montenegrin Exclusive economic Zone","Europe","Montenegro"
"196",NA,5670,"Albanian Exclusive Economic Zone","Europe","the Republic of Albania"
"197",NA,5672,"Bulgarian Exclusive Economic Zone","Europe","the Republic of Bulgaria"
"198",NA,48953,"Palestinian Exclusive Economic Zone","Asia","Palestine"
"199",NA,8357,"Kuwaiti Exclusive Economic Zone","Asia","the State of Kuwait"
"200",NA,8470,"Iraqi Exclusive Economic Zone","Asia","the Republic of Iraq"
"201",NA,8358,"Bahraini Exclusive Economic Zone","Asia","the Kingdom of Bahrain"
"202",NA,8468,"Qatari Exclusive Economic Zone","Asia","the State of Qatar"
"203",NA,8353,"Yemeni Exclusive Economic Zone","Asia","the Republic of Yemen"
"204",NA,8375,"Israeli Exclusive Economic Zone","Asia","the State of Israel"
"205",NA,8491,"Jordanian Exclusive Economic Zone","Asia","the Hashemite Kingdom of Jordan"
"206",NA,8352,"Djiboutian Exclusive Economic Zone","Africa","the Republic of Djibouti"
"207",NA,8481,"Bangladeshi Exclusive Economic Zone","Asia","the People's Republic of Bangladesh"
"208",NA,8474,"Nigerian Exclusive Economic Zone","Africa","the Federal Republic of Nigeria"
"209",NA,8475,"Cameroonian Exclusive Economic Zone","Africa","the Republic of Cameroon"
"210",NA,21797,"Joint regime area Nigeria / Sao Tome and Principe","Africa",NA
"211",NA,48976,"Joint regime area Italy / France","Europe",NA
"212",NA,22491,"Bosnian and Herzegovinian Exclusive Economic Zone","Europe","Bosnia and Herzegovina"
"213",NA,48957,"Guam Exclusive Economic Zone","Oceania","Guam"
"214",NA,8318,"Marshall Islands Exclusive Economic Zone","Oceania","the Republic of the Marshall Islands"
"215",NA,48980,"Northern Mariana Exclusive Economic Zone","Oceania","the Commonwealth of the Northern Mariana Islands"
"216",NA,8315,"Palau Exclusive Economic Zone","Oceania","the Republic of Palau"
"217",NA,8322,"Philippines Exclusive Economic Zone","Asia","the Republic of the Philippines"
"218",NA,48954,"Overlapping claim Senkaku Islands: Japan / China / Taiwan","Asia",NA
"219",NA,8485,"Singaporean Exclusive Economic Zone","Asia","the Republic of Singapore"
"220",NA,8332,"Thailand Exclusive Economic Zone","Asia","the Kingdom of Thailand"
"221",NA,8319,"Wake Island Exclusive Economic Zone","Oceania","the United States Minor Outlying Islands"
"222",NA,8484,"Vietnamese Exclusive Economic Zone","Asia","the Socialist Republic of Viet Nam"
"223",NA,21796,"Joint regime area Japan / Korea","Asia",NA
"224",NA,26521,"Bruneian Exclusive Economic Zone","Asia","Brunei Darussalam"
"225",NA,8321,"Taiwanese Exclusive Economic Zone","Asia","Taiwan Province of China"
"226",NA,8328,"North Korean Exclusive Economic Zone","Asia","the Democratic People's Republic of Korea"
"227",NA,8331,"Cambodian Exclusive Economic Zone","Asia","the Kingdom of Cambodia"
"228",NA,8486,"Chinese Exclusive Economic Zone","Asia","the People's Republic of China"
"229",NA,5675,"Estonian Exclusive Economic Zone","Europe","the Republic of Estonia"
"230",NA,5676,"Finnish Exclusive Economic Zone","Europe","the Republic of Finland"
"231",NA,5694,"Swedish Exclusive Economic Zone","Europe","the Kingdom of Sweden"
"232",NA,5684,"Lithuanian Exclusive Economic Zone","Europe","the Republic of Lithuania"
"233",NA,48977,"Joint regime area Sweden / Norway","Europe",NA
"234",NA,3293,"Belgian Exclusive Economic Zone","Europe","the Kingdom of Belgium"
"235",NA,5668,"Dutch Exclusive Economic Zone","Europe","the Kingdom of the Netherlands"
"236",NA,5669,"German Exclusive Economic Zone","Europe","the Federal Republic of Germany"
"237",NA,5674,"Danish Exclusive Economic Zone","Europe","the Kingdom of Denmark"
"238",NA,5683,"Latvian Exclusive Economic Zone","Europe","the Republic of Latvia"
"239",NA,5673,"Croatian Exclusive Economic Zone","Europe","the Republic of Croatia"
"240",NA,5682,"Italian Exclusive Economic Zone","Europe","the Republic of Italy"
"241",NA,5695,"Overlapping claim Ukrainian Exclusive Economic Zone","Europe",NA
"242",NA,5689,"Romanian Exclusive economic Zone","Europe","Romania"
"243",NA,8487,"Japanese Exclusive Economic Zone","Asia","Japan"
"244",NA,48950,"Overlapping claim Kuril Islands: Japan / Russia",NA,NA
"245",NA,8333,"Indian Exclusive Economic Zone (Andaman and Nicobar Islands)","Asia",NA
"246",NA,8359,"Pakistani Exclusive Economic Zone","Asia","the Islamic Republic of Pakistan"
"247",NA,26523,"Turkmen Exclusive Economic Zone","Asia","Turkmenistan"
"248",NA,26524,"Azerbaijanis Exclusive Economic Zone","Asia","the Republic of Azerbaijan"
"249",NA,26522,"Kazakh Exclusive Economic Zone","Asia","the Republic of Kazakhstan"
"250",NA,8482,"Myanmar Exclusive Economic Zone","Asia","the Republic of the Union of Myanmar"
"251",NA,5687,"Polish Exclusive Economic Zone","Europe","the Republic of Poland"
"252",NA,8480,"Indian Exclusive Economic Zone","Asia","the Republic of India"
"253",NA,26582,"Overlapping claim: Sudan / Egypt","Africa",NA
"254",NA,8393,"Beninese Exclusive Economic Zone","Africa","the Republic of Benin"
"255",NA,5692,"Slovenian Exclusive Economic Zone","Europe","the Republic of Slovenia"
"256",NA,8483,"Malaysian Exclusive Economic Zone","Asia","Malaysia"
"257",NA,49003,"Overlapping claim South China Sea","Asia",NA
"258",NA,50167,"Joint regime area Croatia / Slovenia","Europe",NA
"259",NA,8327,"South Korean Exclusive Economic Zone","Asia","the Republic of Korea"
"260",NA,48955,"Overlapping claim Liancourt Rocks: Japan / South Korea","Asia",NA
"261",NA,50170,"Overlapping claim Qatar / Saudi Arabia / United Arab Emirates","Asia",NA
"262",NA,8455,"New Zealand Exclusive Economic Zone","Oceania","New Zealand"
"263",NA,8442,"Jarvis Island Exclusive Economic Zone","Oceania","the United States Minor Outlying Islands"
"264",NA,8326,"Tuvaluan Exclusive Economic Zone","Oceania","Tuvalu"
"265",NA,8454,"Wallis and Futuna Exclusive Economic Zone","Oceania","the Wallis and Futuna Islands"
"266",NA,8451,"Howland and Baker Islands Exclusive Economic Zone","Oceania","the United States Minor Outlying Islands"
"267",NA,8325,"Fijian Exclusive Economic Zone","Oceania","the Republic of Fiji"
"268",NA,8464,"Brazilian Exclusive Economic Zone","Americas","the Federative Republic of Brazil"
"269",NA,8441,"Kiribati Exclusive Economic Zone (Line Islands)","Oceania","the Republic of Kiribati"
"270",NA,8488,"Kiribati Exclusive Economic Zone (Gilbert Islands)","Oceania","the Republic of Kiribati"
"271",NA,8403,"Ecuadorian Exclusive Economic Zone (Galapagos)","Americas","the Republic of Ecuador"
"272",NA,8431,"Ecuadorian Exclusive Economic Zone","Americas","the Republic of Ecuador"
"273",NA,8397,"Sao Tome and Principe Exclusive Economic Zone","Africa","the Democratic Republic of Sao Tome and Principe"
"274",NA,8316,"Micronesian Exclusive Economic Zone","Oceania","the Federated States of Micronesia"
"275",NA,8398,"Equatorial Guinean Exclusive Economic Zone","Africa","the Republic of Equatorial Guinea"
"276",NA,8345,"Maldives Exclusive Economic Zone","Asia","the Republic of Maldives"
"277",NA,8324,"Papua New Guinean Exclusive Economic Zone","Oceania","the Independent State of Papua New Guinea"
"278",NA,8350,"Somali Exclusive Economic Zone","Africa","the Federal Republic of Somalia"
"279",NA,8317,"Nauruan Exclusive Economic Zone","Oceania","the Republic of Nauru"
"280",NA,8476,"Gabonese Exclusive Economic Zone","Africa","the Gabonese Republic"
"281",NA,8492,"Indonesian Exclusive Economic Zone","Asia","the Republic of Indonesia"
"282",NA,48978,"Joint regime area United States / Russia",NA,NA
"283",NA,5677,"French Exclusive Economic Zone","Europe","the French Republic"
"284",NA,8378,"Algerian Exclusive Economic Zone","Africa","the People's Democratic Republic of Algeria"
"285",NA,8400,"Ghanaian Exclusive Economic Zone","Africa","the Republic of Ghana"
"286",NA,8438,"Greenlandic Exclusive Economic Zone","Americas","Greenland"
"287",NA,5696,"United Kingdom Exclusive Economic Zone","Europe","the United Kingdom of Great Britain and Northern Ireland"
"288",NA,8453,"United States Exclusive Economic Zone (Hawaii)","Americas","the United States of America"
"289",NA,33181,"Svalbard Exclusive Economic Zone","Europe","the Svalbard and Jan Mayen Islands"
"290",NA,5686,"Norwegian Exclusive Economic Zone","Europe","the Kingdom of Norway"
"291",NA,5690,"Russian Exclusive economic Zone","Europe","the Russian Federation"
"292",NA,8437,"Jan Mayen Exclusive Economic Zone","Europe","the Svalbard and Jan Mayen Islands"
"293",NA,8463,"United States Exclusive Economic Zone (Alaska)","Americas","the United States of America"
"294",NA,5693,"Spanish Exclusive Economic Zone","Europe","the Kingdom of Spain"
"295",NA,62589,"Chagos Archipelago Exclusive Economic Zone","Africa","the Republic of Mauritius"
"296",NA,8383,"Overlapping claim South Georgia and South Sandwich Islands: UK / Argentina","Americas",NA
"297",NA,8402,"Bermudian Exclusive Economic Zone","Americas","Bermuda"
"298",NA,8456,"United States Exclusive Economic Zone","Americas","the United States of America"
